{
  "$schema": "https://json-schema.org/draft/2020-12/schema",
  "$id": "https://swiftserve.dev/schemas/capability-record-v1.json",
  "title": "SwiftServe Capability Record",
  "description": "One package × one capability × every platform. Every supported/unsupported claim is anchored to the package's extracted surface; the validator (V01–V07) is the only gate.",
  "type": "object",
  "additionalProperties": false,
  "required": ["recordVersion", "package", "capability", "platforms", "requiresCompanion", "notes", "labeledBy", "labeledAt"],
  "properties": {
    "recordVersion": { "type": "integer", "const": 1 },
    "package": {
      "type": "object",
      "additionalProperties": false,
      "required": ["canonicalURL", "name", "aliases", "version", "commit", "surfaceDigest"],
      "properties": {
        "canonicalURL": { "type": "string", "description": "https://github.com/owner/repo, lowercase, no .git" },
        "name": { "type": "string" },
        "aliases": { "type": "array", "items": { "type": "string" } },
        "version": { "type": "string", "description": "the tag the surface was extracted at" },
        "commit": { "type": "string" },
        "surfaceDigest": { "type": "string", "description": "fnv1a64:… digest of the surface JSON — drift detector" }
      }
    },
    "capability": {
      "type": "object",
      "additionalProperties": false,
      "required": ["id", "label"],
      "properties": {
        "id": { "type": "string", "description": "taxonomy id, e.g. audio.noise-cancellation" },
        "label": { "type": "string" }
      }
    },
    "platforms": {
      "type": "object",
      "description": "Platform → claim. Missing platforms draw a coverage warning; ‘unknown’ is an honest, welcome answer.",
      "additionalProperties": false,
      "patternProperties": {
        "^(iOS|macOS|watchOS|tvOS|visionOS|macCatalyst|linux)$": {
          "type": "object",
          "additionalProperties": false,
          "required": ["status", "confidence", "evidence"],
          "properties": {
            "status": { "type": "string", "enum": ["supported", "unsupported", "conditional", "unknown"] },
            "confidence": { "type": "number", "minimum": 0, "maximum": 0.95, "description": "capped by evidence strength: 0.6 all-conditional, 0.3 readme/manifest-only, 0.7 macro-flagged, 0.8 binary targets" },
            "evidence": {
              "type": "array",
              "items": {
                "type": "object",
                "additionalProperties": false,
                "required": ["kind", "symbol", "file", "line", "condition", "availability", "package", "note"],
                "properties": {
                  "kind": { "type": "string", "enum": ["symbol", "guard", "availability", "manifestPlatforms", "readme"] },
                  "symbol": { "type": ["string", "null"], "description": "EXACT qualified name from the surface (required for symbol/guard/availability)" },
                  "file": { "type": ["string", "null"], "description": "repo-relative path, must match the surface decl" },
                  "line": { "type": ["integer", "null"] },
                  "condition": { "type": ["string", "null"], "description": "the #if guard text, e.g. os(iOS)" },
                  "availability": { "type": ["string", "null"] },
                  "package": { "type": ["string", "null"], "description": "canonical URL when citing a companion package's surface" },
                  "note": { "type": ["string", "null"] }
                }
              }
            }
          }
        }
      }
    },
    "requiresCompanion": { "type": "array", "items": { "type": "string" }, "description": "canonical URLs of companion packages" },
    "notes": { "type": ["string", "null"] },
    "labeledBy": { "type": "string", "description": "claude-code-session | api | human — audit only; the validator is the gate" },
    "labeledAt": { "type": "string", "description": "ISO-8601" }
  }
}