[
  {
    "capability" : {
      "id" : "midi.io",
      "label" : "MIDI input/output"
    },
    "labeledAt" : "2026-07-02T15:00:00Z",
    "labeledBy" : "claude-code-session",
    "notes" : "Lightweight CoreMIDI wrapper: discovery, connections, MIDI 1/2 parsing.",
    "package" : {
      "aliases" : [
        "bradhowes/morkandmidi"
      ],
      "canonicalURL" : "https://github.com/bradhowes/morkandmidi",
      "commit" : "07cdd56620f6948a9e30aa3519b30268daea4b6f",
      "name" : "MorkAndMIDI",
      "surfaceDigest" : "fnv1a64:83f2db859805cb3d",
      "version" : "5.1.0"
    },
    "platforms" : {
      "iOS" : {
        "confidence" : 0.85,
        "evidence" : [
          {
            "availability" : null,
            "condition" : null,
            "file" : "Sources/MorkAndMIDI/MIDI.swift",
            "kind" : "symbol",
            "line" : 10,
            "note" : "CoreMIDI connection manager",
            "package" : null,
            "symbol" : "MIDI"
          },
          {
            "availability" : null,
            "condition" : null,
            "file" : null,
            "kind" : "manifestPlatforms",
            "line" : null,
            "note" : "manifest declares iOS 16",
            "package" : null,
            "symbol" : null
          }
        ],
        "status" : "supported"
      },
      "linux" : {
        "confidence" : 0.1,
        "evidence" : [
          {
            "availability" : null,
            "condition" : null,
            "file" : null,
            "kind" : "readme",
            "line" : null,
            "note" : "CoreMIDI is Apple-only",
            "package" : null,
            "symbol" : null
          }
        ],
        "status" : "unknown"
      },
      "macCatalyst" : {
        "confidence" : 0.75,
        "evidence" : [
          {
            "availability" : null,
            "condition" : null,
            "file" : "Sources/MorkAndMIDI/MIDI.swift",
            "kind" : "symbol",
            "line" : 10,
            "note" : "CoreMIDI connection manager",
            "package" : null,
            "symbol" : "MIDI"
          }
        ],
        "status" : "supported"
      },
      "macOS" : {
        "confidence" : 0.85,
        "evidence" : [
          {
            "availability" : null,
            "condition" : null,
            "file" : "Sources/MorkAndMIDI/MIDI.swift",
            "kind" : "symbol",
            "line" : 10,
            "note" : "CoreMIDI connection manager",
            "package" : null,
            "symbol" : "MIDI"
          },
          {
            "availability" : null,
            "condition" : null,
            "file" : null,
            "kind" : "manifestPlatforms",
            "line" : null,
            "note" : "manifest declares macOS 13",
            "package" : null,
            "symbol" : null
          }
        ],
        "status" : "supported"
      },
      "tvOS" : {
        "confidence" : 0.2,
        "evidence" : [
          {
            "availability" : null,
            "condition" : null,
            "file" : null,
            "kind" : "manifestPlatforms",
            "line" : null,
            "note" : "tvOS absent from manifest floors",
            "package" : null,
            "symbol" : null
          }
        ],
        "status" : "unknown"
      },
      "visionOS" : {
        "confidence" : 0.25,
        "evidence" : [
          {
            "availability" : null,
            "condition" : null,
            "file" : null,
            "kind" : "manifestPlatforms",
            "line" : null,
            "note" : "visionOS absent from manifest floors",
            "package" : null,
            "symbol" : null
          }
        ],
        "status" : "unknown"
      },
      "watchOS" : {
        "confidence" : 0.2,
        "evidence" : [
          {
            "availability" : null,
            "condition" : null,
            "file" : null,
            "kind" : "manifestPlatforms",
            "line" : null,
            "note" : "watchOS absent from manifest floors",
            "package" : null,
            "symbol" : null
          }
        ],
        "status" : "unknown"
      }
    },
    "recordVersion" : 1,
    "requiresCompanion" : [

    ]
  }
]
