[
  {
    "capability" : {
      "id" : "video.playback",
      "label" : "Video playback"
    },
    "labeledAt" : "2026-07-02T15:00:00Z",
    "labeledBy" : "claude-code-session",
    "notes" : "Mux video player over AVPlayerViewController/AVPlayerLayer.",
    "package" : {
      "aliases" : [
        "muxinc/mux-player-swift"
      ],
      "canonicalURL" : "https://github.com/muxinc/mux-player-swift",
      "commit" : "974bb44689a8b3bc541eb082728c1317f65af197",
      "name" : "MuxPlayerSwift",
      "surfaceDigest" : "fnv1a64:0671fd884e491880",
      "version" : "v1.7.0"
    },
    "platforms" : {
      "iOS" : {
        "confidence" : 0.85,
        "evidence" : [
          {
            "availability" : null,
            "condition" : null,
            "file" : "Sources/MuxPlayerSwift/PublicAPI/ViewController/MuxPlayerContainerViewController.swift",
            "kind" : "symbol",
            "line" : 10,
            "note" : null,
            "package" : null,
            "symbol" : "MuxPlayerContainerViewController"
          },
          {
            "availability" : null,
            "condition" : null,
            "file" : null,
            "kind" : "manifestPlatforms",
            "line" : null,
            "note" : "manifest declares iOS",
            "package" : null,
            "symbol" : null
          }
        ],
        "status" : "supported"
      },
      "linux" : {
        "confidence" : 0.1,
        "evidence" : [
          {
            "availability" : null,
            "condition" : null,
            "file" : null,
            "kind" : "readme",
            "line" : null,
            "note" : "AVFoundation/Apple-frameworks based",
            "package" : null,
            "symbol" : null
          }
        ],
        "status" : "unknown"
      },
      "macCatalyst" : {
        "confidence" : 0.7,
        "evidence" : [
          {
            "availability" : null,
            "condition" : null,
            "file" : "Sources/MuxPlayerSwift/PublicAPI/ViewController/MuxPlayerContainerViewController.swift",
            "kind" : "symbol",
            "line" : 10,
            "note" : null,
            "package" : null,
            "symbol" : "MuxPlayerContainerViewController"
          }
        ],
        "status" : "supported"
      },
      "macOS" : {
        "confidence" : 0.25,
        "evidence" : [
          {
            "availability" : null,
            "condition" : null,
            "file" : null,
            "kind" : "manifestPlatforms",
            "line" : null,
            "note" : "macOS absent from manifest floors; no source fence",
            "package" : null,
            "symbol" : null
          }
        ],
        "status" : "unknown"
      },
      "tvOS" : {
        "confidence" : 0.25,
        "evidence" : [
          {
            "availability" : null,
            "condition" : null,
            "file" : null,
            "kind" : "manifestPlatforms",
            "line" : null,
            "note" : "tvOS absent from manifest floors; no source fence",
            "package" : null,
            "symbol" : null
          }
        ],
        "status" : "unknown"
      },
      "visionOS" : {
        "confidence" : 0.25,
        "evidence" : [
          {
            "availability" : null,
            "condition" : null,
            "file" : null,
            "kind" : "manifestPlatforms",
            "line" : null,
            "note" : "visionOS absent from manifest floors; no source fence",
            "package" : null,
            "symbol" : null
          }
        ],
        "status" : "unknown"
      },
      "watchOS" : {
        "confidence" : 0.25,
        "evidence" : [
          {
            "availability" : null,
            "condition" : null,
            "file" : null,
            "kind" : "manifestPlatforms",
            "line" : null,
            "note" : "watchOS absent from manifest floors; no source fence",
            "package" : null,
            "symbol" : null
          }
        ],
        "status" : "unknown"
      }
    },
    "recordVersion" : 1,
    "requiresCompanion" : [

    ]
  }
]