[
  {
    "capability" : {
      "id" : "speech.stt",
      "label" : "Speech-to-text"
    },
    "labeledAt" : "2026-07-02T12:00:00Z",
    "labeledBy" : "claude-code-session",
    "notes" : "On-device Whisper via CoreML. Streaming transcription via AudioStreamTranscriber.",
    "package" : {
      "aliases" : [
        "argmaxinc/WhisperKit"
      ],
      "canonicalURL" : "https://github.com/argmaxinc/whisperkit",
      "commit" : "25c62997041c134b03ca82731ce2f6fd2cae1eb9",
      "name" : "WhisperKit",
      "surfaceDigest" : "fnv1a64:216ebcb72ab973ad",
      "version" : "v1.0.0"
    },
    "platforms" : {
      "iOS" : {
        "confidence" : 0.85,
        "evidence" : [
          {
            "availability" : null,
            "condition" : null,
            "file" : "Sources/WhisperKit/Core/WhisperKit.swift",
            "kind" : "symbol",
            "line" : 11,
            "note" : null,
            "package" : null,
            "symbol" : "WhisperKit"
          },
          {
            "availability" : null,
            "condition" : null,
            "file" : "Sources/WhisperKit/Core/WhisperKit.swift",
            "kind" : "symbol",
            "line" : 587,
            "note" : "async transcription entry point",
            "package" : null,
            "symbol" : "WhisperKit.transcribe"
          }
        ],
        "status" : "supported"
      },
      "linux" : {
        "confidence" : 0.1,
        "evidence" : [
          {
            "availability" : null,
            "condition" : null,
            "file" : null,
            "kind" : "readme",
            "line" : null,
            "note" : "CoreML-based on-device inference; no Linux artifacts observed, nothing in source proves absence",
            "package" : null,
            "symbol" : null
          }
        ],
        "status" : "unknown"
      },
      "macCatalyst" : {
        "confidence" : 0.7,
        "evidence" : [
          {
            "availability" : null,
            "condition" : null,
            "file" : "Sources/WhisperKit/Core/WhisperKit.swift",
            "kind" : "symbol",
            "line" : 11,
            "note" : null,
            "package" : null,
            "symbol" : "WhisperKit"
          }
        ],
        "status" : "supported"
      },
      "macOS" : {
        "confidence" : 0.85,
        "evidence" : [
          {
            "availability" : null,
            "condition" : null,
            "file" : "Sources/WhisperKit/Core/WhisperKit.swift",
            "kind" : "symbol",
            "line" : 11,
            "note" : null,
            "package" : null,
            "symbol" : "WhisperKit"
          },
          {
            "availability" : null,
            "condition" : null,
            "file" : "Sources/WhisperKit/Core/WhisperKit.swift",
            "kind" : "symbol",
            "line" : 587,
            "note" : "async transcription entry point",
            "package" : null,
            "symbol" : "WhisperKit.transcribe"
          }
        ],
        "status" : "supported"
      },
      "tvOS" : {
        "confidence" : 0.2,
        "evidence" : [
          {
            "availability" : null,
            "condition" : null,
            "file" : null,
            "kind" : "manifestPlatforms",
            "line" : null,
            "note" : "tvOS absent from the manifest platform floors; no source fence proves absence",
            "package" : null,
            "symbol" : null
          }
        ],
        "status" : "unknown"
      },
      "visionOS" : {
        "confidence" : 0.7,
        "evidence" : [
          {
            "availability" : null,
            "condition" : null,
            "file" : "Sources/WhisperKit/Core/WhisperKit.swift",
            "kind" : "symbol",
            "line" : 11,
            "note" : null,
            "package" : null,
            "symbol" : "WhisperKit"
          },
          {
            "availability" : null,
            "condition" : null,
            "file" : null,
            "kind" : "manifestPlatforms",
            "line" : null,
            "note" : "manifest declares visionOS 1",
            "package" : null,
            "symbol" : null
          }
        ],
        "status" : "supported"
      },
      "watchOS" : {
        "confidence" : 0.7,
        "evidence" : [
          {
            "availability" : null,
            "condition" : null,
            "file" : "Sources/WhisperKit/Core/WhisperKit.swift",
            "kind" : "symbol",
            "line" : 11,
            "note" : null,
            "package" : null,
            "symbol" : "WhisperKit"
          },
          {
            "availability" : null,
            "condition" : null,
            "file" : null,
            "kind" : "manifestPlatforms",
            "line" : null,
            "note" : "manifest declares watchOS 10",
            "package" : null,
            "symbol" : null
          }
        ],
        "status" : "supported"
      }
    },
    "recordVersion" : 1,
    "requiresCompanion" : [

    ]
  }
]