[
  {
    "capability" : {
      "id" : "audio.device-selection",
      "label" : "Audio device selection"
    },
    "labeledAt" : "2026-07-02T16:00:00Z",
    "labeledBy" : "claude-code-session",
    "notes" : "Device enumeration/selection + status events over the CoreAudio HAL.",
    "package" : {
      "aliases" : [
        "ryanfrancesconi/spfk-audio-hardware"
      ],
      "canonicalURL" : "https://github.com/ryanfrancesconi/spfk-audio-hardware",
      "commit" : "ebe07274a6cd4c77f390b2726b9ebfd85ea5cf13",
      "name" : "SPFKAudioHardware",
      "surfaceDigest" : "fnv1a64:cadbceda056d6e79",
      "version" : "5.2.0"
    },
    "platforms" : {
      "iOS" : {
        "confidence" : 0.25,
        "evidence" : [
          {
            "availability" : null,
            "condition" : null,
            "file" : null,
            "kind" : "manifestPlatforms",
            "line" : null,
            "note" : "CoreAudio HAL is macOS-only in practice; manifest declares macOS only",
            "package" : null,
            "symbol" : null
          }
        ],
        "status" : "unknown"
      },
      "linux" : {
        "confidence" : 0.1,
        "evidence" : [
          {
            "availability" : null,
            "condition" : null,
            "file" : null,
            "kind" : "readme",
            "line" : null,
            "note" : "CoreAudio is Apple-only",
            "package" : null,
            "symbol" : null
          }
        ],
        "status" : "unknown"
      },
      "macCatalyst" : {
        "confidence" : 0.25,
        "evidence" : [
          {
            "availability" : null,
            "condition" : null,
            "file" : null,
            "kind" : "manifestPlatforms",
            "line" : null,
            "note" : "manifest declares macOS only",
            "package" : null,
            "symbol" : null
          }
        ],
        "status" : "unknown"
      },
      "macOS" : {
        "confidence" : 0.85,
        "evidence" : [
          {
            "availability" : null,
            "condition" : null,
            "file" : "Sources/SPFKAudioHardware/Public/AudioObject/AudioDevice/AudioDevice.swift",
            "kind" : "symbol",
            "line" : 11,
            "note" : "CoreAudio device object",
            "package" : null,
            "symbol" : "AudioDevice"
          },
          {
            "availability" : null,
            "condition" : null,
            "file" : null,
            "kind" : "manifestPlatforms",
            "line" : null,
            "note" : "manifest declares macOS 13 only",
            "package" : null,
            "symbol" : null
          }
        ],
        "status" : "supported"
      },
      "tvOS" : {
        "confidence" : 0.2,
        "evidence" : [
          {
            "availability" : null,
            "condition" : null,
            "file" : null,
            "kind" : "manifestPlatforms",
            "line" : null,
            "note" : "manifest declares macOS only",
            "package" : null,
            "symbol" : null
          }
        ],
        "status" : "unknown"
      },
      "visionOS" : {
        "confidence" : 0.2,
        "evidence" : [
          {
            "availability" : null,
            "condition" : null,
            "file" : null,
            "kind" : "manifestPlatforms",
            "line" : null,
            "note" : "manifest declares macOS only",
            "package" : null,
            "symbol" : null
          }
        ],
        "status" : "unknown"
      },
      "watchOS" : {
        "confidence" : 0.2,
        "evidence" : [
          {
            "availability" : null,
            "condition" : null,
            "file" : null,
            "kind" : "manifestPlatforms",
            "line" : null,
            "note" : "manifest declares macOS only",
            "package" : null,
            "symbol" : null
          }
        ],
        "status" : "unknown"
      }
    },
    "recordVersion" : 1,
    "requiresCompanion" : [

    ]
  }
]