[
  {
    "capability" : {
      "id" : "video.playback",
      "label" : "Video playback"
    },
    "labeledAt" : "2026-07-02T15:00:00Z",
    "labeledBy" : "claude-code-session",
    "notes" : "360° video playback (SceneKit + AVPlayer).",
    "package" : {
      "aliases" : [
        "abdullahselek/swifty360player"
      ],
      "canonicalURL" : "https://github.com/abdullahselek/swifty360player",
      "commit" : "a3a9249e34ce1bdcfa20c0780fdbec26a6396ddb",
      "name" : "Swifty360Player",
      "surfaceDigest" : "fnv1a64:2222cfab63ab519a",
      "version" : "0.2.7"
    },
    "platforms" : {
      "iOS" : {
        "confidence" : 0.8,
        "evidence" : [
          {
            "availability" : null,
            "condition" : null,
            "file" : "Swifty360Player/Swifty360CameraController.swift",
            "kind" : "symbol",
            "line" : 57,
            "note" : null,
            "package" : null,
            "symbol" : "Swifty360CameraController"
          },
          {
            "availability" : null,
            "condition" : null,
            "file" : null,
            "kind" : "manifestPlatforms",
            "line" : null,
            "note" : "manifest declares iOS",
            "package" : null,
            "symbol" : null
          }
        ],
        "status" : "supported"
      },
      "linux" : {
        "confidence" : 0.1,
        "evidence" : [
          {
            "availability" : null,
            "condition" : null,
            "file" : null,
            "kind" : "readme",
            "line" : null,
            "note" : "AVFoundation/Apple-frameworks based",
            "package" : null,
            "symbol" : null
          }
        ],
        "status" : "unknown"
      },
      "macCatalyst" : {
        "confidence" : 0.7,
        "evidence" : [
          {
            "availability" : null,
            "condition" : null,
            "file" : "Swifty360Player/Swifty360CameraController.swift",
            "kind" : "symbol",
            "line" : 57,
            "note" : null,
            "package" : null,
            "symbol" : "Swifty360CameraController"
          }
        ],
        "status" : "supported"
      },
      "macOS" : {
        "confidence" : 0.25,
        "evidence" : [
          {
            "availability" : null,
            "condition" : null,
            "file" : null,
            "kind" : "manifestPlatforms",
            "line" : null,
            "note" : "macOS absent from manifest floors; no source fence",
            "package" : null,
            "symbol" : null
          }
        ],
        "status" : "unknown"
      },
      "tvOS" : {
        "confidence" : 0.25,
        "evidence" : [
          {
            "availability" : null,
            "condition" : null,
            "file" : null,
            "kind" : "manifestPlatforms",
            "line" : null,
            "note" : "tvOS absent from manifest floors; no source fence",
            "package" : null,
            "symbol" : null
          }
        ],
        "status" : "unknown"
      },
      "visionOS" : {
        "confidence" : 0.25,
        "evidence" : [
          {
            "availability" : null,
            "condition" : null,
            "file" : null,
            "kind" : "manifestPlatforms",
            "line" : null,
            "note" : "visionOS absent from manifest floors; no source fence",
            "package" : null,
            "symbol" : null
          }
        ],
        "status" : "unknown"
      },
      "watchOS" : {
        "confidence" : 0.25,
        "evidence" : [
          {
            "availability" : null,
            "condition" : null,
            "file" : null,
            "kind" : "manifestPlatforms",
            "line" : null,
            "note" : "watchOS absent from manifest floors; no source fence",
            "package" : null,
            "symbol" : null
          }
        ],
        "status" : "unknown"
      }
    },
    "recordVersion" : 1,
    "requiresCompanion" : [

    ]
  }
]